{
  "day": "2026-10-13",
  "dayCompact": "20261013",
  "dayStamp": 1791820800000,
  "alarm": "09:30:15",
  "alarmShort": "09:30",
  "at": "2026-10-13T09:30:15+08:00",
  "atIsoMs": "2026-10-13T09:30:15.000+08:00",
  "atUtc": "2026-10-13T01:30:15Z",
  "atUtcMs": "2026-10-13T01:30:15.000Z",
  "atMs": 1791855015000,
  "atSec": 1791855015,
  "atText": "2026-10-13 09:30:15"
}
